{
  "schema_version": 1,
  "generated_at": "2026-10-19T09:00:00+00:00",
  "updated_locations": [
    "cagliari",
    "torre-dei-corsari"
  ],
  "errors": {},
  "locations": {
    "cagliari": {
      "location": {
        "name": "Cagliari",
        "latitude": 39.17,
        "longitude": 9.15,
        "slug": "cagliari"
      },
      "cells": {
        "marine": {
          "latitude": 39.208336,
          "longitude": 9.125015
        },
        "weather": {
          "latitude": 39.24347,
          "longitude": 9.141709,
          "elevation_m": 0.0
        }
      },
      "timezone": "Europe/Rome",
      "generated_at": "2026-10-19T09:00:00+00:00",
      "sources": {
        "sea": {
          "id": "open_meteo_marine",
          "provider": "Open-Meteo",
          "service": "Marine Weather API",
          "endpoint": "https://marine-api.open-meteo.com/v1/marine",
          "model_selection": "best_match, scelto dinamicamente dal provider",
          "variables": {
            "hourly": [
              "wave_height",
              "wave_direction",
              "wave_period",
              "sea_surface_temperature"
            ],
            "daily": []
          },
          "requested_coordinates": {
            "latitude": 39.17,
            "longitude": 9.15
          },
          "resolved_cell": {
            "latitude": 39.208336,
            "longitude": 9.125015,
            "elevation_m": 0.0
          },
          "fetched_at": "2026-10-19T09:00:00+00:00",
          "attribution": "Marine data by Open-Meteo.com",
          "documentation_url": "https://open-meteo.com/en/docs/marine-weather-api",
          "license_url": "https://open-meteo.com/en/terms"
        },
        "weather": {
          "id": "open_meteo_weather",
          "provider": "Open-Meteo",
          "service": "Weather Forecast API",
          "endpoint": "https://api.open-meteo.com/v1/forecast",
          "model_selection": "best_match, scelto dinamicamente dal provider",
          "variables": {
            "hourly": [
              "temperature_2m",
              "wind_speed_10m",
              "wind_direction_10m",
              "wind_gusts_10m"
            ],
            "daily": [
              "weather_code",
              "temperature_2m_min",
              "temperature_2m_max",
              "wind_speed_10m_max",
              "wind_gusts_10m_max"
            ]
          },
          "requested_coordinates": {
            "latitude": 39.17,
            "longitude": 9.15
          },
          "resolved_cell": {
            "latitude": 39.24347,
            "longitude": 9.141709,
            "elevation_m": 0.0
          },
          "fetched_at": "2026-10-19T09:00:00+00:00",
          "attribution": "Weather data by Open-Meteo.com",
          "documentation_url": "https://open-meteo.com/en/docs",
          "license_url": "https://open-meteo.com/en/terms"
        }
      },
      "daily": [
        {
          "date": "2026-10-19",
          "sea": {
            "state": "Mosso",
            "wave_height_mean_m": 0.69,
            "wave_height_max_m": 0.86,
            "wave_period_mean_s": 4.04,
            "wave_direction_mean_deg": 138.0,
            "wave_direction_name": "Scirocco",
            "water_temperature_mean_c": 24.0
          },
          "weather": {
            "air_temperature_mean_c": 22.5,
            "air_temperature_min_c": 20.9,
            "air_temperature_max_c": 24.6,
            "weather_code": 95,
            "wind_speed_mean_kmh": 15.5,
            "wind_speed_max_kmh": 21.7,
            "wind_gust_mean_kmh": 33.5,
            "wind_gust_max_kmh": 44.6,
            "wind_direction_mean_deg": 132.0,
            "wind_name": "Scirocco"
          }
        },
        {
          "date": "2026-10-20",
          "sea": {
            "state": "Mosso",
            "wave_height_mean_m": 1.17,
            "wave_height_max_m": 1.46,
            "wave_period_mean_s": 5.58,
            "wave_direction_mean_deg": 143.0,
            "wave_direction_name": "Scirocco",
            "water_temperature_mean_c": 23.9
          },
          "weather": {
            "air_temperature_mean_c": 22.3,
            "air_temperature_min_c": 19.5,
            "air_temperature_max_c": 24.3,
            "weather_code": 95,
            "wind_speed_mean_kmh": 15.0,
            "wind_speed_max_kmh": 23.5,
            "wind_gust_mean_kmh": 35.4,
            "wind_gust_max_kmh": 53.6,
            "wind_direction_mean_deg": 138.0,
            "wind_name": "Scirocco"
          }
        },
        {
          "date": "2026-10-21",
          "sea": {
            "state": "Mosso",
            "wave_height_mean_m": 0.62,
            "wave_height_max_m": 0.94,
            "wave_period_mean_s": 5.83,
            "wave_direction_mean_deg": 158.0,
            "wave_direction_name": "Ostro",
            "water_temperature_mean_c": 23.8
          },
          "weather": {
            "air_temperature_mean_c": 20.4,
            "air_temperature_min_c": 16.7,
            "air_temperature_max_c": 25.2,
            "weather_code": 3,
            "wind_speed_mean_kmh": 10.5,
            "wind_speed_max_kmh": 25.3,
            "wind_gust_mean_kmh": 24.1,
            "wind_gust_max_kmh": 53.6,
            "wind_direction_mean_deg": 315.0,
            "wind_name": "Maestrale"
          }
        },
        {
          "date": "2026-10-22",
          "sea": {
            "state": "Poco mosso",
            "wave_height_mean_m": 0.28,
            "wave_height_max_m": 0.36,
            "wave_period_mean_s": 4.38,
            "wave_direction_mean_deg": 227.0,
            "wave_direction_name": "Libeccio",
            "water_temperature_mean_c": 23.6
          },
          "weather": {
            "air_temperature_mean_c": 18.2,
            "air_temperature_min_c": 14.7,
            "air_temperature_max_c": 22.6,
            "weather_code": 3,
            "wind_speed_mean_kmh": 12.8,
            "wind_speed_max_kmh": 33.9,
            "wind_gust_mean_kmh": 28.5,
            "wind_gust_max_kmh": 72.7,
            "wind_direction_mean_deg": 318.0,
            "wind_name": "Maestrale"
          }
        },
        {
          "date": "2026-10-23",
          "sea": {
            "state": "Poco mosso",
            "wave_height_mean_m": 0.12,
            "wave_height_max_m": 0.18,
            "wave_period_mean_s": 4.2,
            "wave_direction_mean_deg": 209.0,
            "wave_direction_name": "Libeccio",
            "water_temperature_mean_c": 23.2
          },
          "weather": {
            "air_temperature_mean_c": 17.7,
            "air_temperature_min_c": 12.3,
            "air_temperature_max_c": 23.8,
            "weather_code": 3,
            "wind_speed_mean_kmh": 7.5,
            "wind_speed_max_kmh": 11.0,
            "wind_gust_mean_kmh": 17.1,
            "wind_gust_max_kmh": 26.3,
            "wind_direction_mean_deg": 321.0,
            "wind_name": "Maestrale"
          }
        },
        {
          "date": "2026-10-24",
          "sea": {
            "state": "Poco mosso",
            "wave_height_mean_m": 0.17,
            "wave_height_max_m": 0.26,
            "wave_period_mean_s": 2.79,
            "wave_direction_mean_deg": 255.0,
            "wave_direction_name": "Ponente",
            "water_temperature_mean_c": 23.0
          },
          "weather": {
            "air_temperature_mean_c": 18.0,
            "air_temperature_min_c": 15.9,
            "air_temperature_max_c": 21.1,
            "weather_code": 3,
            "wind_speed_mean_kmh": 17.8,
            "wind_speed_max_kmh": 32.7,
            "wind_gust_mean_kmh": 37.0,
            "wind_gust_max_kmh": 60.5,
            "wind_direction_mean_deg": 322.0,
            "wind_name": "Maestrale"
          }
        },
        {
          "date": "2026-10-25",
          "sea": {
            "state": "Poco mosso",
            "wave_height_mean_m": 0.18,
            "wave_height_max_m": 0.3,
            "wave_period_mean_s": 3.89,
            "wave_direction_mean_deg": 222.0,
            "wave_direction_name": "Libeccio",
            "water_temperature_mean_c": 22.6
          },
          "weather": {
            "air_temperature_mean_c": 17.4,
            "air_temperature_min_c": 15.7,
            "air_temperature_max_c": 19.3,
            "weather_code": 3,
            "wind_speed_mean_kmh": 12.8,
            "wind_speed_max_kmh": 23.2,
            "wind_gust_mean_kmh": 25.7,
            "wind_gust_max_kmh": 42.1,
            "wind_direction_mean_deg": 319.0,
            "wind_name": "Maestrale"
          }
        }
      ]
    },
    "torre-dei-corsari": {
      "location": {
        "name": "Torre dei Corsari",
        "latitude": 39.688153,
        "longitude": 8.450613,
        "slug": "torre-dei-corsari"
      },
      "cells": {
        "marine": {
          "latitude": 39.708336,
          "longitude": 8.4583435
        },
        "weather": {
          "latitude": 39.70109,
          "longitude": 8.473898,
          "elevation_m": 0.0
        }
      },
      "timezone": "Europe/Rome",
      "generated_at": "2026-10-19T09:00:00+00:00",
      "sources": {
        "sea": {
          "id": "open_meteo_marine",
          "provider": "Open-Meteo",
          "service": "Marine Weather API",
          "endpoint": "https://marine-api.open-meteo.com/v1/marine",
          "model_selection": "best_match, scelto dinamicamente dal provider",
          "variables": {
            "hourly": [
              "wave_height",
              "wave_direction",
              "wave_period",
              "sea_surface_temperature"
            ],
            "daily": []
          },
          "requested_coordinates": {
            "latitude": 39.688153,
            "longitude": 8.450613
          },
          "resolved_cell": {
            "latitude": 39.708336,
            "longitude": 8.4583435,
            "elevation_m": 0.0
          },